category,category_label,name,legal_name,town,url,website
school,Школа,"""30""",Государственное казенное общеобразовательное учреждение города Москвы «Школа № 2124 «Центр развития и коррекции»,Москва,https://moskva.fulledu.ru/school/shkola-30-5440-773183/about/,https://sch2124.mskobr.ru
school,Школа,"""Лицей""","""Лицей""",Балашиха,https://moskva.fulledu.ru/school/shkola-mbou-licey/about/,https://bal-sch11.edumsko.ru
school,Школа,"""Лицей"" г. Бронницы","""Лицей"" г. Бронницы",Бронницы,https://moskva.fulledu.ru/school/srednyaya-obscheobrazovatelnaya-shkola-3-s-uglublnnym-izucheniem-otdelnyh-predmetov/about/,https://brongoo.edumsko.ru/educational_space/obweobrazovatelnye_organizacii
school,Школа,(К)ОУ школа-интернат VIII вида,"МУНИЦИПАЛЬНОЕ КАЗЁННОЕ ОБЩЕОБРАЗОВАТЕЛЬНОЕ УЧРЕЖДЕНИЕ ""КОРРЕКЦИОННАЯ ОБЩЕОБРАЗОВАТЕЛЬНАЯ ШКОЛА-ИНТЕРНАТ"" ГОРОДСКОГО ОКРУГА СТУПИНО МОСКОВСКОЙ ОБЛАСТИ",Ступино,https://moskva.fulledu.ru/school/kou-shkola-internat-viii-vida/about/,https://oshkolah.ru/rossiya/moskva/school/kou-shkola-internat-viii-vida
school,Школа,(коррекционная) казённая образовательная школа № 8 VIII вида,Муниципальное специальное (коррекционное) казённое образовательное учреждение для обучающихся; воспитанников с ограниченными возможностями здоровья специальная (коррекционная) общеобразовательная школа № 8 VIII вида Павлово-Посадского муниципального район,Павловский Посад,https://moskva.fulledu.ru/school/korrekcionnaya-kaznnaya-obrazovatelnaya-shkola-8-viii-vida/about/,https://15kids.ru/institutions/school/moskovskaya-oblast/pavlovskij-posad/37600.html
school,Школа,(коррекционная) общеобразовательная школа - интернат,"МУНИЦИПАЛЬНОЕ БЮДЖЕТНОЕ ОБЩЕОБРАЗОВАТЕЛЬНОЕ УЧРЕЖДЕНИЕ ""БЕРСЕНЕВСКАЯ ОБЩЕОБРАЗОВАТЕЛЬНАЯ ШКОЛА-ИНТЕРНАТ ДЛЯ ДЕТЕЙ С ОГРАНИЧЕННЫМИ ВОЗМОЖНОСТЯМИ ЗДОРОВЬЯ""",деревня Берсеневка,https://moskva.fulledu.ru/school/korrekcionnaya-obscheobrazovatelnaya-shkola-internat/about/,https://kashkorsch.edumsko.ru
school,Школа,(коррекционная) общеобразовательная школа-интернат,МУНИЦИПАЛЬНОЕ БЮДЖЕТНОЕ ОБЩЕОБРАЗОВАТЕЛЬНОЕ УЧРЕЖДЕНИЕ ВЫШЕГОРОДСКАЯ ШКОЛА-ИНТЕРНАТ ДЛЯ ОБУЧАЮЩИХСЯ С ОГРАНИЧЕННЫМИ ВОЗМОЖНОСТЯМИ ЗДОРОВЬЯ,деревня Вышегород,https://moskva.fulledu.ru/school/korrekcionnaya-obscheobrazovatelnaya-shkola-internat-2754-717075/about/,https://kashkorsch.edumsko.ru
school,Школа,(коррекционная) общеобразовательная школа-интернат VIII вида,"МУНИЦИПАЛЬНОЕ БЮДЖЕТНОЕ ОБЩЕОБРАЗОВАТЕЛЬНОЕ УЧРЕЖДЕНИЕ ""КОРОБЧЕЕВСКАЯ ШКОЛА ДЛЯ ОБУЧАЮЩИХСЯ С ОГРАНИЧЕННЫМИ ВОЗМОЖНОСТЯМИ ЗДОРОВЬЯ""",село Коробчеево,https://moskva.fulledu.ru/school/korrekcionnaya-obscheobrazovatelnaya-shkola-internat-viii-vida-3661-212224/about/,https://korobcheevo-kolomna.edumsko.ru
school,Школа,(коррекционная) общеобразовательная школа-интернат для слепых и слабовидящих детей,"МУНИЦИПАЛЬНОЕ БЮДЖЕТНОЕ ОБЩЕОБРАЗОВАТЕЛЬНОЕ УЧРЕЖДЕНИЕ ГОРОДСКОГО ОКРУГА КОРОЛЁВ МОСКОВСКОЙ ОБЛАСТИ ""ШКОЛА-ИНТЕРНАТ ДЛЯ СЛЕПЫХ И СЛАБОВИДЯЩИХ ДЕТЕЙ""",Королев,https://moskva.fulledu.ru/school/korrekcionnaya-obscheobrazovatelnaya-shkola-internat-dlya-slepyh-i-slabovidyaschih-detey/about/,https://internat.edusite.ru/p1aa1.html
school,Школа,(коррекционная) школа - интернат,МУНИЦИПАЛЬНОЕ СПЕЦИАЛЬНОЕ ОБЩЕОБРАЗОВАТЕЛЬНОЕ УЧРЕЖДЕНИЕ ЗАПРУДНЕНСКАЯ ШКОЛА-ИНТЕРНАТ ДЛЯ ОБУЧАЮЩИХСЯ С ОГРАНИЧЕННЫМИ ВОЗМОЖНОСТЯМИ ЗДОРОВЬЯ,поселок городского типа Запрудня,https://moskva.fulledu.ru/school/korrekcionnaya-shkola-internat/about/,https://zaprobr.edumsko.ru/activity/classes/420522
school,Школа,(сменная) общеобразовательная школа,(сменная) общеобразовательная школа,Подольск,https://moskva.fulledu.ru/school/smennaya-obscheobrazovatelnaya-shkola-8743-447576/about/,https://schoolotzyv.ru/schools/9-russia/143-moskovskaya/71467-shkola-34
school,Школа,(сменная) общеобразовательная школа,(сменная) общеобразовательная школа,Жуковский,https://moskva.fulledu.ru/school/smennaya-obscheobrazovatelnaya-shkola-7620-306503/about/,https://schoolme.ru/jukovskiy/mou-vssh
school,Школа,(сменная) общеобразовательная школа,(сменная) общеобразовательная школа,Зарайск,https://moskva.fulledu.ru/school/smennaya-obscheobrazovatelnaya-shkola-7350-859252/about/,https://uo-zar.edumsko.ru
school,Школа,(сменная) общеобразовательная школа г. Талдома,(сменная) общеобразовательная школа г. Талдома,Талдом,https://moskva.fulledu.ru/school/smennaya-obscheobrazovatelnaya-shkola-g-taldoma/about/,https://mo.mosreg.ru/download/document/15882780
school,Школа,(сменная) общеобразовательная школа №1,(сменная) общеобразовательная школа №1,Луховицы,https://moskva.fulledu.ru/school/smennaya-obscheobrazovatelnaya-shkola-1/about/,https://edu-s.ru/luhovitsyi/shkola--1
school,Школа,(сменное) общеобразовательное учреждение открытая (сменная) общеобразовательная школа Щёлковского муниципального района Московской области,(сменное) общеобразовательное учреждение открытая (сменная) общеобразовательная школа Щёлковского муниципального района Московской области,Щелково,https://moskva.fulledu.ru/school/smennoe-obscheobrazovatelnoe-uchrezhdenie-otkrytaya-smennaya-obscheobrazovatelnaya-shkola-schlkovsko/about/,
school,Школа,*,*,Москва,https://moskva.fulledu.ru/school/shkola-centr-obrazovaniya-175/about/,
school,Школа,*,128,Москва,https://moskva.fulledu.ru/school/srednyaya-obscheobrazovatelnaya-shkola-128-8298-141043/about/,
school,Школа,*,Государственное Бюджетное Образовательное Учреждение Города Москвы Средняя Общеобразовательная Школа № 1447 Имени Н.а. Островского,Москва,https://moskva.fulledu.ru/school/shkola-centr-obrazovaniya-1447-im-na-ostrovskogo/about/,
school,Школа,/К/ОУ школа-интернат VIII вида,"МУНИЦИПАЛЬНОЕ БЮДЖЕТНОЕ ОБЩЕОБРАЗОВАТЕЛЬНОЕ УЧРЕЖДЕНИЕ ГОРОДСКОГО ОКРУГА ПУШКИНСКИЙ МОСКОВСКОЙ ОБЛАСТИ ""ШКОЛА-ИНТЕРНАТ ДЛЯ ОБУЧАЮЩИХСЯ С ОГРАНИЧЕННЫМИ ВОЗМОЖНОСТЯМИ ЗДОРОВЬЯ""",Красноармейск,https://moskva.fulledu.ru/school/kou-shkola-internat-viii-vida-1846-497928/about/,
school,Школа,1 корпус (5-6 классы),Государственное бюджетное образовательное учреждение города Москвы средняя общеобразовательная школа № 544,Москва,https://moskva.fulledu.ru/school/srednyaya-obscheobrazovatelnaya-shkola-544/about/,
school,Школа,1-4 класс - Корпус № 9,Государственное бюджетное образовательное учреждение города Москвы средняя общеобразовательная школа № 329,Москва,https://moskva.fulledu.ru/school/nachalnaya-shkola-detskiy-sad-kompensiruuschego-vida-1883/about/,
school,Школа,1-4 классы,1-4 классы,Москва,https://moskva.fulledu.ru/school/nachalnaya-shkola-detskiy-sad-kompensiruuschego-vida-1892/about/,
school,Школа,1-й корпус,"Государственное бюджетное образовательное учреждение города Москвы средняя общеобразовательная школа с углубленным изучением отдельных предметов № 1393 ""Школа РОСТ""",Москва,https://moskva.fulledu.ru/school/srednyaya-obscheobrazovatelnaya-shkola-84/about/,
school,Школа,2 корпус,698,Москва,https://moskva.fulledu.ru/school/shkola-698/about/,
school,Школа,2 корпус (7-11 классы),Государственное бюджетное образовательное учреждение города Москвы средняя общеобразовательная школа № 544,Москва,https://moskva.fulledu.ru/school/vechernyaya-smennaya-obscheobrazovatelnaya-shkola-144/about/,
school,Школа,2-й корпус,894,Москва,https://moskva.fulledu.ru/school/srednyaya-obscheobrazovatelnaya-shkola-894/about/,
school,Школа,3 корпус (1 классы),Государственное бюджетное образовательное учреждение города Москвы средняя общеобразовательная школа № 544,Москва,https://moskva.fulledu.ru/school/srednyaya-obscheobrazovatlenaya-shkola-centr-obrazovaniya-vstuplenie/about/,
school,Школа,5 - 11 класс ШО1,Государственное бюджетное общеобразовательное учреждение города Москвы «Школа № 1359 имени авиаконструктора М.Л. Миля»,Москва,https://moskva.fulledu.ru/school/srednyaya-obscheobrazovatelnaya-shkola-s-uglublennym-izucheniem-angliyskogo-yazyka-1359/about/,
school,Школа,5 - 11 класс ШО2,Государственное бюджетное образовательное учреждение города Москвы средняя общеобразовательная школа с углубленным изучением английского языка № 1359,Москва,https://moskva.fulledu.ru/school/shkola-centr-obrazovaniya-1457/about/,
school,Школа,5-11 классы,Государственное бюджетное общеобразовательное учреждение города Москвы «Школа № 1356»,Москва,https://moskva.fulledu.ru/school/srednyaya-obscheobrazovatelnaya-shkola-1356-s-uglublennym-izucheniem-otdelnyh-predmetov/about/,
school,Школа,5-9 классы (для детей с тяжелым нарушением речи),(коррекционная) общеобразовательная школа V вида № 573,Москва,https://moskva.fulledu.ru/school/shkola-v-vida-573/about/,
school,Школа,7-11 КЛАССЫ,Государственное бюджетное образовательное учреждение города Москвы средняя общеобразовательная школа № 1959 «Дети мира»,Москва,https://moskva.fulledu.ru/school/srednyaya-obscheobrazovatelnaya-shkola-1959-shkola-zdorovya/about/,
school,Школа,Cредняя общеобразовательная Школа,1380,Москва,https://moskva.fulledu.ru/school/srednyaya-obscheobrazovatelnaya-shkola-s-uglublennym-izucheniem-angliyskogo-yazyka-1380/about/,
school,Школа,Cредняя общеобразовательная школа с углубленным изучением английского и французского языков№ 1203,Cредняя общеобразовательная школа с углубленным изучением английского и французского языков№ 1203,Москва,https://moskva.fulledu.ru/school/crednyaya-obscheobrazovatelnaya-shkola-s-uglublennym-izucheniem-angliyskogo-i-francuzskogo-yazykov-1/about/,
school,Школа,Cредняя общеобразовательная школа №14,Cредняя общеобразовательная школа №14,Балашиха,https://moskva.fulledu.ru/school/shkola-maou-sosh-14-5371-7433/about/,
school,Школа,Cредняя общеобразовательная школа №15 с русским этнокультурным компонентом,Cредняя общеобразовательная школа №15 с русским этнокультурным компонентом,Жуковский,https://moskva.fulledu.ru/school/shkola-n-15/about/,
school,Школа,Cредняя общеобразовательная школа №2 имени С.И.Руденко посёлка Монино Щёлковского муниципального района Московской области,Cредняя общеобразовательная школа №2 имени С.И.Руденко посёлка Монино Щёлковского муниципального района Московской области,поселок городского типа Монино,https://moskva.fulledu.ru/school/srednyaya-obscheobrazovatelnaya-shkola-2-imeni-sirudenko-p-monino/about/,
school,Школа,Cредняя общеобразовательная школа №3,Cредняя общеобразовательная школа №3,Подольск,https://moskva.fulledu.ru/school/shkola-3-2229-146086/about/,
school,Школа,Cредняя общеобразовательная школа №3 имени С.А. Красовского посёлка Монино Щёлковского муниципального района Московской области,Cредняя общеобразовательная школа №3 имени С.А. Красовского посёлка Монино Щёлковского муниципального района Московской области,поселок городского типа Монино,https://moskva.fulledu.ru/school/srednyaya-obscheobrazovatelnaya-shkola-3-imeni-sakrasovskogo-p-monino/about/,
school,Школа,Cредняя общеобразовательная школа №4,Cредняя общеобразовательная школа №4,Красноармейск,https://moskva.fulledu.ru/school/srednyaya-obscheobrazovatelnaya-shkola-4-5337-27913/about/,
school,Школа,cредняя общеобразовательная школа №4,cредняя общеобразовательная школа №4,Егорьевск,https://moskva.fulledu.ru/school/shkola-mbou-sosh-4-5301-4644/about/,
school,Школа,cредняя общеобразовательная школа №4 имени Петра Ильича Климука Щёлковского муниципального района Московской области,cредняя общеобразовательная школа №4 имени Петра Ильича Климука Щёлковского муниципального района Московской области,Щелково,https://moskva.fulledu.ru/school/srednyaya-obscheobrazovatelnaya-shkola-4-2107-530533/about/,
school,Школа,Cредняя общеобразовательная школа №5 с углубленным изучением отдельных предметов,Cредняя общеобразовательная школа №5 с углубленным изучением отдельных предметов,Подольск,https://moskva.fulledu.ru/school/shkola-5-s-uglublennym-izucheniem-otdelnyh-predmetov-6754-171895/about/,
school,Школа,Cредняя общеобразовательная школа №8 города Красногорска,Cредняя общеобразовательная школа №8 города Красногорска,Красногорск,https://moskva.fulledu.ru/school/shkola-8-6248-199540/about/,
school,Школа,EngWish LangWish,EngWish LangWish,поселок городского типа Свердловский,https://moskva.fulledu.ru/school/engwish-langwish/about/,
school,Школа,Forum School,"Автономная некоммерческая общеобразовательная организация ""Таланты и способности""",Химки,https://moskva.fulledu.ru/school/forum-school-himki/about/,
school,Школа,Gimnasium. Школа героев,Gimnasium. Школа героев,деревня Жуковка,https://moskva.fulledu.ru/school/gimnasium-shkola-geroev/about/,
school,Школа,II учебный корпус,Государственное бюджетное образовательное учреждение города Москвы средняя общеобразовательная школа с углубленным изучением английского языка № 1287,Москва,https://moskva.fulledu.ru/school/srednyaya-obscheobrazovatelnaya-shkola-704/about/,
school,Школа,Music Stars,Music Stars,деревня Жуковка,https://moskva.fulledu.ru/school/music-stars/about/,
school,Школа,Step-English - Курсы английского языка на ВДНХ,Step-English - Курсы английского языка на ВДНХ,Москва,https://moskva.fulledu.ru/school/step-english-kursy-angliyskogo-yazyka-na-vdnh/about/,
school,Школа,XXI век,XXI век,Москва,https://moskva.fulledu.ru/school/shkola-xxi-vek/about/,
school,Школа,"«Каширская коррекционная общеобразовательная школа-интернат ""","«Каширская коррекционная общеобразовательная школа-интернат """,деревня Корыстово,https://moskva.fulledu.ru/school/mskou-kashirskaya-specialnaya-korrekcionnaya-obscheobrazovatelnaya-shkola-internat-viii-vida/about/,
school,Школа,«Лицей №3» им. Главного маршала авиации А.Е. Голованова,«Лицей №3» им. Главного маршала авиации А.Е. Голованова,Дзержинский,https://moskva.fulledu.ru/school/shkola-mbou-licey-3/about/,
school,Школа,Авангард,"Муниципальное Бюджетное Образовательное  Учреждение Дополнительного  Образования Детей ""специализированная  Детско-Юношеская  Спортивная Школа Олимпийского Резерва ""авангард""",Коломна,https://moskva.fulledu.ru/school/shkola-mbou-dod-sdusshor-avangard/about/,
school,Школа,Авсюнинская СОШ,"Муниципальное Бюджетное Общеобразовательное Учреждение ""авсюнинская Средняя Общеобразовательная Школа"" Орехово-Зуевского Муниципального Района Московской Области",поселок Авсюнино,https://moskva.fulledu.ru/school/shkola-mbou-avsuninskaya-sosh/about/,
school,Школа,Авсюнинская средняя общеобразовательная школа,Авсюнинская средняя общеобразовательная школа,поселок Авсюнино,https://moskva.fulledu.ru/school/avsuninskaya-srednyaya-obscheobrazovatelnaya-shkola/about/,
school,Школа,Автономная некоммерческая организация общеразовательная средняя школа Город солнца,Автономная некоммерческая организация общеразовательная средняя школа Город солнца,поселок Нагорное,https://moskva.fulledu.ru/school/avtonomnaya-nekommercheskaya-organizaciya-obscherazovatelnaya-srednyaya-shkola-gorod-solnca/about/,
school,Школа,Автономная некоммерческая организация средняя общеобразовательная школа Логос,Автономная некоммерческая организация средняя общеобразовательная школа Логос,Москва,https://moskva.fulledu.ru/school/avtonomnaya-nekommercheskaya-organizaciya-srednyaya-obscheobrazovatelnaya-shkola-logos/about/,
school,Школа,Автономная некоммерческая организация средняя общеобразовательная школа ПРИОРИТЕТ,Автономная некоммерческая организация средняя общеобразовательная школа ПРИОРИТЕТ,Москва,https://moskva.fulledu.ru/school/avtonomnaya-nekommercheskaya-organizaciya-srednyaya-obscheobrazovatelnaya-shkola-prioritet/about/,
school,Школа,Автономная некоммерческая организация средняя общеобразовательная школа Учебный центр Перспектива,Автономная некоммерческая организация средняя общеобразовательная школа Учебный центр Перспектива,Москва,https://moskva.fulledu.ru/school/avtonomnaya-nekommercheskaya-organizaciya-srednyaya-obscheobrazovatelnaya-shkola-uchebnyy-centr-pers/about/,
school,Школа,Автономная некоммерческая организация Средняя общеобразовательная школа “ЭЛЛАДА”,"Общеобразовательная автономная некоммерческая организация Гимназия ""Эллада"" во имя святых Кирилла и Мефодия",Москва,https://moskva.fulledu.ru/school/avtonomnaya-nekommercheskaya-organizaciya-srednyaya-obscheobrazovatelnaya-shkola-ellada/about/,
school,Школа,Агинская средняя общеобразовательная школа № 4,Агинская средняя общеобразовательная школа № 4,Москва,https://moskva.fulledu.ru/school/aginskaya-srednyaya-obscheobrazovatelnaya-shkola-4/about/,
school,Школа,АКАДЕМ.ГИМНАЗИЯ,"АВТОНОМНАЯ НЕКОММЕРЧЕСКАЯ ОРГАНИЗАЦИЯ СРЕДНЯЯ ОБЩЕОБРАЗОВАТЕЛЬНАЯ ШКОЛА ""АКАДЕМИЧЕСКАЯ ГИМНАЗИЯ""",Москва,https://moskva.fulledu.ru/school/ano-sosh-akademgimnaziya-171488/about/,
school,Школа,Акатьевская основная общеобразовательная школа,Муниципальное Общеобразовательное Учреждение Акатьевская Основная Общеобразовательная Школа,село Акатьево,https://moskva.fulledu.ru/school/mou-akatevskaya-osnovnaya-obscheobrazovatelnaya-shkola/about/,
school,Школа,Акатьевская средняя общеобразовательная школа,Акатьевская средняя общеобразовательная школа,село Акатьево,https://moskva.fulledu.ru/school/akatevskaya-srednyaya-obscheobrazovatelnaya-shkola/about/,
school,Школа,Аксеновская основная общеобразовательная школа,Аксеновская основная общеобразовательная школа,деревня Аксеново,https://moskva.fulledu.ru/school/aksenovskaya-osnovnaya-obscheobrazovatelnaya-shkola/about/,
school,Школа,Акуловская средняя общеобразовательная школа,Акуловская средняя общеобразовательная школа,Кубинка,https://moskva.fulledu.ru/school/akulovskaya-srednyaya-obscheobrazovatelnaya-shkola/about/,
school,Школа,Алабинская средняя общеобразовательная школа с углубленным изучением отдельных предметов,Алабинская средняя общеобразовательная школа с углубленным изучением отдельных предметов,поселок городского типа Калининец,https://moskva.fulledu.ru/school/alabinskaya-srednyaya-obscheobrazovatelnaya-shkola-s-uglublennym-izucheniem-otdelnyh-predmetov/about/,
school,Школа,Алгоритмика,Алгоритмика,Москва,https://moskva.fulledu.ru/school/algoritmika/about/,
